{
  "alert_ownership": {
    "coverage_statement": "Research-hours coverage; 24/7 staffing is not required. Every paper alert has a named owner and response target.",
    "policies": [
      {
        "alert_type": "FAILED_INGESTION",
        "coverage": "RESEARCH_HOURS",
        "owner": "market-data-owner",
        "response_expectation": "Stop dependent paper strategies, preserve the failed partition and restart or backfill after diagnosis.",
        "response_target_minutes": 30,
        "severity": "CRITICAL"
      },
      {
        "alert_type": "INVALID_BOOK",
        "coverage": "RESEARCH_HOURS",
        "owner": "market-data-owner",
        "response_expectation": "Confirm automatic strategy gating, cancel ordinary orders on the venue and force a clean snapshot resync.",
        "response_target_minutes": 15,
        "severity": "CRITICAL"
      },
      {
        "alert_type": "REPLAY_FAILURE",
        "coverage": "RESEARCH_HOURS",
        "owner": "research-infrastructure-owner",
        "response_expectation": "Quarantine the run, retain its checkpoint and raw lineage, then resume only after a deterministic replay check.",
        "response_target_minutes": 240,
        "severity": "HIGH"
      },
      {
        "alert_type": "RISK_BREACH",
        "coverage": "RESEARCH_HOURS",
        "owner": "paper-risk-owner",
        "response_expectation": "Confirm the kill state, cancel new-risk orders, permit only approved risk reduction and reconcile before resume.",
        "response_target_minutes": 15,
        "severity": "CRITICAL"
      },
      {
        "alert_type": "PIPELINE_THRESHOLD",
        "coverage": "RESEARCH_HOURS",
        "owner": "research-infrastructure-owner",
        "response_expectation": "Inspect the breached pipeline threshold and record disposition before the next paper session.",
        "response_target_minutes": 240,
        "severity": "WARNING"
      },
      {
        "alert_type": "EXECUTION_THRESHOLD",
        "coverage": "RESEARCH_HOURS",
        "owner": "paper-trading-owner",
        "response_expectation": "Inspect the execution threshold, residual and connector state; suspend new risk if safety is uncertain.",
        "response_target_minutes": 30,
        "severity": "HIGH"
      }
    ],
    "schema_version": "1.0.0"
  },
  "alerts": [],
  "books": {
    "BINANCE": {
      "age_ns": 53000000,
      "checksum_failures": 0,
      "duplicates": 0,
      "gaps": 0,
      "instrument_id": "BTC-USDT-SPOT",
      "out_of_order": 0,
      "sequence": 140,
      "state": "VALID"
    },
    "BYBIT": {
      "age_ns": 6000000,
      "checksum_failures": 0,
      "duplicates": 0,
      "gaps": 0,
      "instrument_id": "BTC-USDT-SPOT",
      "out_of_order": 0,
      "sequence": 49,
      "state": "VALID"
    }
  },
  "correlation_id": "parity",
  "data": {
    "canonical_events": 90,
    "clock": "LOCAL_RECEIVE_TIME",
    "event_count": 90,
    "latest_persisted_receive_ts_ns": 1637000000,
    "trade_ticks": 88,
    "wire_records": 178
  },
  "generated_ts_ns": 1639000000,
  "health": "HEALTHY",
  "job": {
    "mode": "CONTINUOUS",
    "state": "COMPLETE"
  },
  "live": {
    "durable_fsync": false,
    "persistence_lag_ns": 23000000,
    "reconnects": 0,
    "stale_disconnects": 0
  },
  "metrics": [
    {
      "breached": false,
      "comparator": "<=",
      "health_on_breach": "CRITICAL",
      "name": "data_age_ns",
      "scope": "PIPELINE",
      "threshold": 1000000000,
      "unit": "nanoseconds",
      "value": 53000000
    },
    {
      "breached": false,
      "comparator": ">=",
      "health_on_breach": "CRITICAL",
      "name": "partition_completeness",
      "scope": "PIPELINE",
      "threshold": 1.0,
      "unit": "ratio",
      "value": 1.0
    },
    {
      "breached": false,
      "comparator": "<=",
      "health_on_breach": "CRITICAL",
      "name": "sequence_gaps",
      "scope": "PIPELINE",
      "threshold": 0,
      "unit": "count",
      "value": 0
    },
    {
      "breached": false,
      "comparator": "<=",
      "health_on_breach": "CRITICAL",
      "name": "invalid_books",
      "scope": "PIPELINE",
      "threshold": 0,
      "unit": "count",
      "value": 0
    },
    {
      "breached": false,
      "comparator": "<=",
      "health_on_breach": "CRITICAL",
      "name": "schema_mismatches",
      "scope": "PIPELINE",
      "threshold": 0,
      "unit": "count",
      "value": 0
    },
    {
      "breached": false,
      "comparator": "<=",
      "health_on_breach": "DEGRADED",
      "name": "reconnects",
      "scope": "PIPELINE",
      "threshold": 10,
      "unit": "count",
      "value": 0
    },
    {
      "breached": false,
      "comparator": "<=",
      "health_on_breach": "CRITICAL",
      "name": "stale_disconnects",
      "scope": "PIPELINE",
      "threshold": 5,
      "unit": "count",
      "value": 0
    },
    {
      "breached": false,
      "comparator": "<=",
      "health_on_breach": "DEGRADED",
      "name": "persistence_lag_ns",
      "scope": "PIPELINE",
      "threshold": 5000000000,
      "unit": "nanoseconds",
      "value": 23000000
    }
  ],
  "mode": "LIVE",
  "partitions": {
    "active": 0,
    "complete": 1,
    "completeness": 1.0,
    "rejected": 0,
    "total": 1
  },
  "performance": {
    "replay_events_per_second": 0
  },
  "restart_resilience": {},
  "schema_version": "1.0.0",
  "strategy_execution": {},
  "structured_logs": {
    "components": {
      "CONNECTOR": 99
    },
    "database": "structured_logs.sqlite",
    "failed_opportunities": 0,
    "jsonl": "structured_logs.jsonl",
    "levels": {
      "INFO": 99
    },
    "records": 99,
    "schema_version": "1.0.0",
    "searchable_fields": [
      "correlation_id",
      "component",
      "level",
      "event_type",
      "venue",
      "source_event_id",
      "feature_state_id",
      "opportunity_id",
      "risk_decision_id",
      "parent_plan_id",
      "child_order_id",
      "request_id"
    ]
  },
  "tca": {},
  "thresholds": {
    "max_active_kill_switches": 0,
    "max_data_age_ns": 1000000000,
    "max_dispatch_latency_ns": 10000000,
    "max_gaps": 0,
    "max_invalid_books": 0,
    "max_open_residual_base": 0.002,
    "max_order_rejects": 0,
    "max_persistence_lag_ns": 5000000000,
    "max_rate_limit_utilization": 0.9,
    "max_reconnects": 10,
    "max_schema_mismatches": 0,
    "max_stale_disconnects": 5,
    "max_unhealthy_connectors": 0,
    "min_partition_completeness": 1.0,
    "min_replay_events_per_second": 1.0
  },
  "versions": {
    "canonical_schema_expected": "1.2.0",
    "canonical_schema_observed": [
      "1.2.0"
    ],
    "instrument_master": {
      "content_sha256": "04c05f877e7e19fbfe8ab85525c9efdb3da031918dc21acd3ea03ebcdc1e2997",
      "fee_rule_count": 2,
      "instrument_count": 2,
      "schema_version": "1.1.0",
      "status_event_count": 0,
      "version_count": 2
    },
    "schema_mismatches": 0,
    "wire_schema_version": "1.0.0"
  }
}